{
  "generated_at": "2026-03-29 23:59:00 CET",
  "default_profile": "tower-first",
  "profiles": [
    "tower-first",
    "photon-safe"
  ],
  "targets": [
    {
      "id": "tower",
      "target": "clems@192.168.0.120",
      "host": "192.168.0.120",
      "port": 22,
      "role": "Serveur collaboration et data plane principal",
      "priority": 1,
      "placement": "primary",
      "enabled_profiles": [
        "tower-first",
        "photon-safe"
      ],
      "critical_repos": [
        "Kill_LIFE",
        "mascarade",
        "crazy_life"
      ],
      "non_essential_policy": "degrade-nonessential-first",
      "reserve_only": false,
      "load_order_bias": 1000,
      "notes": "Noeud principal pour la collaboration, la Suite Numerique, l'observabilite et une partie importante du runtime Mascarade."
    },
    {
      "id": "photon",
      "target": "root@192.168.0.119",
      "host": "192.168.0.119",
      "port": 22,
      "role": "Edge proxy, reverse proxy et services partages critiques",
      "priority": 2,
      "placement": "secondary",
      "enabled_profiles": [
        "tower-first",
        "photon-safe"
      ],
      "critical_repos": [
        "Kill_LIFE",
        "mascarade",
        "crazy_life"
      ],
      "non_essential_policy": "edge-minimal-only",
      "reserve_only": false,
      "load_order_bias": 1500,
      "notes": "Point d'entree reseau de la flotte; doit rester minimal et privilegier Traefik, connectivite et services pivots."
    },
    {
      "id": "kxkm-ai",
      "target": "kxkm@100.87.54.119",
      "host": "100.87.54.119",
      "port": 22,
      "role": "Station IA GPU, inference lourde, CAD headless et audio",
      "priority": 3,
      "placement": "secondary",
      "enabled_profiles": [
        "tower-first",
        "photon-safe"
      ],
      "critical_repos": [
        "Kill_LIFE",
        "mascarade"
      ],
      "non_essential_policy": "gpu-jobs-priority",
      "reserve_only": false,
      "load_order_bias": 2000,
      "notes": "Noeud RTX 4090 dedie a l'inference GPU, WhisperX, CAD headless, PlatformIO et generation audio."
    },
    {
      "id": "grosmac",
      "target": "electron@100.80.178.42",
      "host": "100.80.178.42",
      "port": 22,
      "role": "Poste operateur local, developpement et inference de proximite",
      "priority": 4,
      "placement": "local",
      "enabled_profiles": [
        "tower-first",
        "photon-safe"
      ],
      "critical_repos": [
        "Kill_LIFE",
        "mascarade",
        "crazy_life"
      ],
      "non_essential_policy": "operator-workstation",
      "reserve_only": false,
      "load_order_bias": 4000,
      "notes": "Machine de developpement et de pilotage local avec Ollama et montages SMB vers Photon."
    },
    {
      "id": "cils",
      "target": "cisl@100.126.225.111",
      "host": "100.126.225.111",
      "port": 22,
      "role": "Noeud legacy de secours et petits modeles",
      "priority": 5,
      "placement": "reserve",
      "enabled_profiles": [
        "tower-first",
        "photon-safe"
      ],
      "critical_repos": [
        "Kill_LIFE",
        "mascarade"
      ],
      "non_essential_policy": "reserve-only",
      "reserve_only": true,
      "load_order_bias": 9000,
      "notes": "Machine legacy stable mais non prioritaire, utilisee comme secours operateur et inference legere."
    }
  ]
}
